No.     Time           Source                Destination           Protocol Length Info
      1 0.000000       10.160.64.139         10.160.65.202         SMB2     172    Negotiate Protocol Request

Frame 1: 172 bytes on wire (1376 bits), 172 bytes captured (1376 bits) on interface unknown, id 0
Ethernet II, Src: Xensourc_44:52:5c (00:16:3e:44:52:5c), Dst: RealtekU_e8:f0:9a (52:54:00:e8:f0:9a)
    Destination: RealtekU_e8:f0:9a (52:54:00:e8:f0:9a)
        Address: RealtekU_e8:f0:9a (52:54:00:e8:f0:9a)
        .... ..1. .... .... .... .... = LG bit: Locally administered address (this is NOT the factory default)
        .... ...0 .... .... .... .... = IG bit: Individual address (unicast)
    Source: Xensourc_44:52:5c (00:16:3e:44:52:5c)
        Address: Xensourc_44:52:5c (00:16:3e:44:52:5c)
        .... ..0. .... .... .... .... = LG bit: Globally unique address (factory default)
        .... ...0 .... .... .... .... = IG bit: Individual address (unicast)
    Type: IPv4 (0x0800)
Internet Protocol Version 4, Src: 10.160.64.139, Dst: 10.160.65.202
    0100 .... = Version: 4
    .... 0101 = Header Length: 20 bytes (5)
    Differentiated Services Field: 0x00 (DSCP: CS0, ECN: Not-ECT)
        0000 00.. = Differentiated Services Codepoint: Default (0)
        .... ..00 = Explicit Congestion Notification: Not ECN-Capable Transport (0)
    Total Length: 158
    Identification: 0x1ae8 (6888)
    Flags: 0x40, Don't fragment
        0... .... = Reserved bit: Not set
        .1.. .... = Don't fragment: Set
        ..0. .... = More fragments: Not set
    ...0 0000 0000 0000 = Fragment Offset: 0
    Time to Live: 64
    Protocol: TCP (6)
    Header Checksum: 0x87dd [validation disabled]
    [Header checksum status: Unverified]
    Source Address: 10.160.64.139
    Destination Address: 10.160.65.202
Transmission Control Protocol, Src Port: 38166, Dst Port: 445, Seq: 1, Ack: 1, Len: 106
    Source Port: 38166
    Destination Port: 445
    [Stream index: 0]
    [Conversation completeness: Incomplete (8)]
    [TCP Segment Len: 106]
    Sequence Number: 1    (relative sequence number)
    Sequence Number (raw): 743359559
    [Next Sequence Number: 107    (relative sequence number)]
    Acknowledgment Number: 1    (relative ack number)
    Acknowledgment number (raw): 1517248813
    1000 .... = Header Length: 32 bytes (8)
    Flags: 0x018 (PSH, ACK)
        000. .... .... = Reserved: Not set
        ...0 .... .... = Nonce: Not set
        .... 0... .... = Congestion Window Reduced (CWR): Not set
        .... .0.. .... = ECN-Echo: Not set
        .... ..0. .... = Urgent: Not set
        .... ...1 .... = Acknowledgment: Set
        .... .... 1... = Push: Set
        .... .... .0.. = Reset: Not set
        .... .... ..0. = Syn: Not set
        .... .... ...0 = Fin: Not set
        [TCP Flags: ·······AP···]
    Window: 457
    [Calculated window size: 457]
    [Window size scaling factor: -1 (unknown)]
    Checksum: 0xaf24 [unverified]
    [Checksum Status: Unverified]
    Urgent Pointer: 0
    Options: (12 bytes), No-Operation (NOP), No-Operation (NOP), Timestamps
        TCP Option - No-Operation (NOP)
            Kind: No-Operation (1)
        TCP Option - No-Operation (NOP)
            Kind: No-Operation (1)
        TCP Option - Timestamps: TSval 3180665811, TSecr 162696613
            Kind: Time Stamp Option (8)
            Length: 10
            Timestamp value: 3180665811
            Timestamp echo reply: 162696613
    [Timestamps]
        [Time since first frame in this TCP stream: 0.000000000 seconds]
        [Time since previous frame in this TCP stream: 0.000000000 seconds]
    [SEQ/ACK analysis]
        [Bytes in flight: 106]
        [Bytes sent since last PSH flag: 106]
    TCP payload (106 bytes)
NetBIOS Session Service
    Message Type: Session message (0x00)
    Length: 102
SMB2 (Server Message Block Protocol version 2)
    SMB2 Header
        ProtocolId: 0xfe534d42
        Header Length: 64
        Credit Charge: 0
        Channel Sequence: 0
        Reserved: 0000
        Command: Negotiate Protocol (0)
        Credits requested: 2
        Flags: 0x00000000
        Chain Offset: 0x00000000
        Message ID: 0
        Process Id: 0x000000d5
        Tree Id: 0x00000000
        Session Id: 0x0000000000000000
        Signature: 00000000000000000000000000000000
        [Response in: 2]
    Negotiate Protocol Request (0x00)
        [Preauth Hash: d72c3320f02b383acb7065f666d6073b0b56c2e782a846d42c268ca5d9d172ed26e65842…]
        StructureSize: 0x0024
        Dialect count: 1
        Security mode: 0x01, Signing enabled
        Reserved: 0000
        Capabilities: 0x00000057, DFS, LEASING, LARGE MTU, PERSISTENT HANDLES, ENCRYPTION
            .... .... .... .... .... .... .... ...1 = DFS: This host supports DFS
            .... .... .... .... .... .... .... ..1. = LEASING: This host supports LEASING
            .... .... .... .... .... .... .... .1.. = LARGE MTU: This host supports LARGE_MTU
            .... .... .... .... .... .... .... 0... = MULTI CHANNEL: This host does NOT support MULTI CHANNEL
            .... .... .... .... .... .... ...1 .... = PERSISTENT HANDLES: This host supports PERSISTENT HANDLES
            .... .... .... .... .... .... ..0. .... = DIRECTORY LEASING: This host does NOT support DIRECTORY LEASING
            .... .... .... .... .... .... .1.. .... = ENCRYPTION: This host supports ENCRYPTION
        Client Guid: a1eefcb2-2495-6541-893f-bf5b2c69acd4
        NegotiateContextOffset: 0x00000000
        NegotiateContextCount: 0
        Reserved: 0000
        Dialect: SMB 3.0 (0x0300)

No.     Time           Source                Destination           Protocol Length Info
      2 0.000356       10.160.65.202         10.160.64.139         SMB2     318    Negotiate Protocol Response

Frame 2: 318 bytes on wire (2544 bits), 318 bytes captured (2544 bits) on interface unknown, id 0
Ethernet II, Src: RealtekU_e8:f0:9a (52:54:00:e8:f0:9a), Dst: Xensourc_44:52:5c (00:16:3e:44:52:5c)
    Destination: Xensourc_44:52:5c (00:16:3e:44:52:5c)
        Address: Xensourc_44:52:5c (00:16:3e:44:52:5c)
        .... ..0. .... .... .... .... = LG bit: Globally unique address (factory default)
        .... ...0 .... .... .... .... = IG bit: Individual address (unicast)
    Source: RealtekU_e8:f0:9a (52:54:00:e8:f0:9a)
        Address: RealtekU_e8:f0:9a (52:54:00:e8:f0:9a)
        .... ..1. .... .... .... .... = LG bit: Locally administered address (this is NOT the factory default)
        .... ...0 .... .... .... .... = IG bit: Individual address (unicast)
    Type: IPv4 (0x0800)
Internet Protocol Version 4, Src: 10.160.65.202, Dst: 10.160.64.139
    0100 .... = Version: 4
    .... 0101 = Header Length: 20 bytes (5)
    Differentiated Services Field: 0x00 (DSCP: CS0, ECN: Not-ECT)
        0000 00.. = Differentiated Services Codepoint: Default (0)
        .... ..00 = Explicit Congestion Notification: Not ECN-Capable Transport (0)
    Total Length: 304
    Identification: 0x72fc (29436)
    Flags: 0x40, Don't fragment
        0... .... = Reserved bit: Not set
        .1.. .... = Don't fragment: Set
        ..0. .... = More fragments: Not set
    ...0 0000 0000 0000 = Fragment Offset: 0
    Time to Live: 128
    Protocol: TCP (6)
    Header Checksum: 0xef36 [validation disabled]
    [Header checksum status: Unverified]
    Source Address: 10.160.65.202
    Destination Address: 10.160.64.139
Transmission Control Protocol, Src Port: 445, Dst Port: 38166, Seq: 1, Ack: 107, Len: 252
    Source Port: 445
    Destination Port: 38166
    [Stream index: 0]
    [Conversation completeness: Incomplete (8)]
    [TCP Segment Len: 252]
    Sequence Number: 1    (relative sequence number)
    Sequence Number (raw): 1517248813
    [Next Sequence Number: 253    (relative sequence number)]
    Acknowledgment Number: 107    (relative ack number)
    Acknowledgment number (raw): 743359665
    1000 .... = Header Length: 32 bytes (8)
    Flags: 0x018 (PSH, ACK)
        000. .... .... = Reserved: Not set
        ...0 .... .... = Nonce: Not set
        .... 0... .... = Congestion Window Reduced (CWR): Not set
        .... .0.. .... = ECN-Echo: Not set
        .... ..0. .... = Urgent: Not set
        .... ...1 .... = Acknowledgment: Set
        .... .... 1... = Push: Set
        .... .... .0.. = Reset: Not set
        .... .... ..0. = Syn: Not set
        .... .... ...0 = Fin: Not set
        [TCP Flags: ·······AP···]
    Window: 8235
    [Calculated window size: 8235]
    [Window size scaling factor: -1 (unknown)]
    Checksum: 0x92cd [unverified]
    [Checksum Status: Unverified]
    Urgent Pointer: 0
    Options: (12 bytes), No-Operation (NOP), No-Operation (NOP), Timestamps
        TCP Option - No-Operation (NOP)
            Kind: No-Operation (1)
        TCP Option - No-Operation (NOP)
            Kind: No-Operation (1)
        TCP Option - Timestamps: TSval 162696615, TSecr 3180665811
            Kind: Time Stamp Option (8)
            Length: 10
            Timestamp value: 162696615
            Timestamp echo reply: 3180665811
    [Timestamps]
        [Time since first frame in this TCP stream: 0.000356000 seconds]
        [Time since previous frame in this TCP stream: 0.000356000 seconds]
    [SEQ/ACK analysis]
        [This is an ACK to the segment in frame: 1]
        [The RTT to ACK the segment was: 0.000356000 seconds]
        [Bytes in flight: 252]
        [Bytes sent since last PSH flag: 252]
    TCP payload (252 bytes)
NetBIOS Session Service
    Message Type: Session message (0x00)
    Length: 248
SMB2 (Server Message Block Protocol version 2)
    SMB2 Header
        ProtocolId: 0xfe534d42
        Header Length: 64
        Credit Charge: 0
        NT Status: STATUS_SUCCESS (0x00000000)
        Command: Negotiate Protocol (0)
        Credits granted: 1
        Flags: 0x00000001, Response
        Chain Offset: 0x00000000
        Message ID: 0
        Process Id: 0x000000d5
        Tree Id: 0x00000000
        Session Id: 0x0000000000000000
        Signature: 00000000000000000000000000000000
        [Response to: 1]
        [Time from request: 0.000356000 seconds]
    Negotiate Protocol Response (0x00)
        [Preauth Hash: 9a0ed1b30067a4b7d0a21b5c48e048f4b5ee1e8a1e765d76cdd813d37652e0cf9d764908…]
        StructureSize: 0x0041
        Security mode: 0x03, Signing enabled, Signing required
        Dialect: SMB 3.0 (0x0300)
        NegotiateContextCount: 0
        Server Guid: bf32f44b-928f-4805-90c0-3ddf2546646e
        Capabilities: 0x00000047, DFS, LEASING, LARGE MTU, ENCRYPTION
            .... .... .... .... .... .... .... ...1 = DFS: This host supports DFS
            .... .... .... .... .... .... .... ..1. = LEASING: This host supports LEASING
            .... .... .... .... .... .... .... .1.. = LARGE MTU: This host supports LARGE_MTU
            .... .... .... .... .... .... .... 0... = MULTI CHANNEL: This host does NOT support MULTI CHANNEL
            .... .... .... .... .... .... ...0 .... = PERSISTENT HANDLES: This host does NOT support PERSISTENT HANDLES
            .... .... .... .... .... .... ..0. .... = DIRECTORY LEASING: This host does NOT support DIRECTORY LEASING
            .... .... .... .... .... .... .1.. .... = ENCRYPTION: This host supports ENCRYPTION
        Max Transaction Size: 8388608
        Max Read Size: 8388608
        Max Write Size: 8388608
        Current Time: May 17, 2017 06:02:16.503207400 EDT
        Boot Time: May 15, 2017 15:51:40.185318400 EDT
        Blob Offset: 0x00000080
        Blob Length: 120
        Security Blob: 607606062b0601050502a06c306aa03c303a060a2b06010401823702021e06092a864882…
        NegotiateContextOffset: 0x00000000

No.     Time           Source                Destination           Protocol Length Info
      3 0.007518       10.160.64.139         10.160.65.202         SMB2     190    Session Setup Request, NTLMSSP_NEGOTIATE

Frame 3: 190 bytes on wire (1520 bits), 190 bytes captured (1520 bits) on interface unknown, id 0
Ethernet II, Src: Xensourc_44:52:5c (00:16:3e:44:52:5c), Dst: RealtekU_e8:f0:9a (52:54:00:e8:f0:9a)
    Destination: RealtekU_e8:f0:9a (52:54:00:e8:f0:9a)
        Address: RealtekU_e8:f0:9a (52:54:00:e8:f0:9a)
        .... ..1. .... .... .... .... = LG bit: Locally administered address (this is NOT the factory default)
        .... ...0 .... .... .... .... = IG bit: Individual address (unicast)
    Source: Xensourc_44:52:5c (00:16:3e:44:52:5c)
        Address: Xensourc_44:52:5c (00:16:3e:44:52:5c)
        .... ..0. .... .... .... .... = LG bit: Globally unique address (factory default)
        .... ...0 .... .... .... .... = IG bit: Individual address (unicast)
    Type: IPv4 (0x0800)
Internet Protocol Version 4, Src: 10.160.64.139, Dst: 10.160.65.202
    0100 .... = Version: 4
    .... 0101 = Header Length: 20 bytes (5)
    Differentiated Services Field: 0x00 (DSCP: CS0, ECN: Not-ECT)
        0000 00.. = Differentiated Services Codepoint: Default (0)
        .... ..00 = Explicit Congestion Notification: Not ECN-Capable Transport (0)
    Total Length: 176
    Identification: 0x1aea (6890)
    Flags: 0x40, Don't fragment
        0... .... = Reserved bit: Not set
        .1.. .... = Don't fragment: Set
        ..0. .... = More fragments: Not set
    ...0 0000 0000 0000 = Fragment Offset: 0
    Time to Live: 64
    Protocol: TCP (6)
    Header Checksum: 0x87c9 [validation disabled]
    [Header checksum status: Unverified]
    Source Address: 10.160.64.139
    Destination Address: 10.160.65.202
Transmission Control Protocol, Src Port: 38166, Dst Port: 445, Seq: 107, Ack: 253, Len: 124
    Source Port: 38166
    Destination Port: 445
    [Stream index: 0]
    [Conversation completeness: Incomplete (8)]
    [TCP Segment Len: 124]
    Sequence Number: 107    (relative sequence number)
    Sequence Number (raw): 743359665
    [Next Sequence Number: 231    (relative sequence number)]
    Acknowledgment Number: 253    (relative ack number)
    Acknowledgment number (raw): 1517249065
    1000 .... = Header Length: 32 bytes (8)
    Flags: 0x018 (PSH, ACK)
        000. .... .... = Reserved: Not set
        ...0 .... .... = Nonce: Not set
        .... 0... .... = Congestion Window Reduced (CWR): Not set
        .... .0.. .... = ECN-Echo: Not set
        .... ..0. .... = Urgent: Not set
        .... ...1 .... = Acknowledgment: Set
        .... .... 1... = Push: Set
        .... .... .0.. = Reset: Not set
        .... .... ..0. = Syn: Not set
        .... .... ...0 = Fin: Not set
        [TCP Flags: ·······AP···]
    Window: 473
    [Calculated window size: 473]
    [Window size scaling factor: -1 (unknown)]
    Checksum: 0xb3b1 [unverified]
    [Checksum Status: Unverified]
    Urgent Pointer: 0
    Options: (12 bytes), No-Operation (NOP), No-Operation (NOP), Timestamps
        TCP Option - No-Operation (NOP)
            Kind: No-Operation (1)
        TCP Option - No-Operation (NOP)
            Kind: No-Operation (1)
        TCP Option - Timestamps: TSval 3180665813, TSecr 162696615
            Kind: Time Stamp Option (8)
            Length: 10
            Timestamp value: 3180665813
            Timestamp echo reply: 162696615
    [Timestamps]
        [Time since first frame in this TCP stream: 0.007518000 seconds]
        [Time since previous frame in this TCP stream: 0.007162000 seconds]
    [SEQ/ACK analysis]
        [This is an ACK to the segment in frame: 2]
        [The RTT to ACK the segment was: 0.007162000 seconds]
        [Bytes in flight: 124]
        [Bytes sent since last PSH flag: 124]
    TCP payload (124 bytes)
NetBIOS Session Service
    Message Type: Session message (0x00)
    Length: 120
SMB2 (Server Message Block Protocol version 2)
    SMB2 Header
        ProtocolId: 0xfe534d42
        Header Length: 64
        Credit Charge: 0
        Channel Sequence: 0
        Reserved: 0000
        Command: Session Setup (1)
        Credits requested: 3
        Flags: 0x00000000
        Chain Offset: 0x00000000
        Message ID: 1
        Process Id: 0x000000d5
        Tree Id: 0x00000000
        Session Id: 0x0000000000000000
        Signature: 00000000000000000000000000000000
        [Response in: 4]
    Session Setup Request (0x01)
        [Preauth Hash: bcd551860c4f395804d51574ec8c2d2d12dab6b6b1cd33ec986ef1cc0d1b52ffd12d5042…]
        StructureSize: 0x0019
        Flags: 0
        Security mode: 0x02, Signing required
        Capabilities: 0x00000000
            .... .... .... .... .... .... .... ...0 = DFS: This host does NOT support DFS
            .... .... .... .... .... .... .... ..0. = LEASING: This host does NOT support LEASING
            .... .... .... .... .... .... .... .0.. = LARGE MTU: This host does NOT support LARGE_MTU
            .... .... .... .... .... .... .... 0... = MULTI CHANNEL: This host does NOT support MULTI CHANNEL
            .... .... .... .... .... .... ...0 .... = PERSISTENT HANDLES: This host does NOT support PERSISTENT HANDLES
            .... .... .... .... .... .... ..0. .... = DIRECTORY LEASING: This host does NOT support DIRECTORY LEASING
            .... .... .... .... .... .... .0.. .... = ENCRYPTION: This host does NOT support ENCRYPTION
        Channel: None (0x00000000)
        Previous Session Id: 0x0000000000000000
        Blob Offset: 0x00000058
        Blob Length: 32
        Security Blob: 4e544c4d5353500001000000350208e000000000000000000000000000000000

No.     Time           Source                Destination           Protocol Length Info
      4 0.007801       10.160.65.202         10.160.64.139         SMB2     318    Session Setup Response, Error: STATUS_MORE_PROCESSING_REQUIRED, NTLMSSP_CHALLENGE

Frame 4: 318 bytes on wire (2544 bits), 318 bytes captured (2544 bits) on interface unknown, id 0
Ethernet II, Src: RealtekU_e8:f0:9a (52:54:00:e8:f0:9a), Dst: Xensourc_44:52:5c (00:16:3e:44:52:5c)
    Destination: Xensourc_44:52:5c (00:16:3e:44:52:5c)
        Address: Xensourc_44:52:5c (00:16:3e:44:52:5c)
        .... ..0. .... .... .... .... = LG bit: Globally unique address (factory default)
        .... ...0 .... .... .... .... = IG bit: Individual address (unicast)
    Source: RealtekU_e8:f0:9a (52:54:00:e8:f0:9a)
        Address: RealtekU_e8:f0:9a (52:54:00:e8:f0:9a)
        .... ..1. .... .... .... .... = LG bit: Locally administered address (this is NOT the factory default)
        .... ...0 .... .... .... .... = IG bit: Individual address (unicast)
    Type: IPv4 (0x0800)
Internet Protocol Version 4, Src: 10.160.65.202, Dst: 10.160.64.139
    0100 .... = Version: 4
    .... 0101 = Header Length: 20 bytes (5)
    Differentiated Services Field: 0x00 (DSCP: CS0, ECN: Not-ECT)
        0000 00.. = Differentiated Services Codepoint: Default (0)
        .... ..00 = Explicit Congestion Notification: Not ECN-Capable Transport (0)
    Total Length: 304
    Identification: 0x72fd (29437)
    Flags: 0x40, Don't fragment
        0... .... = Reserved bit: Not set
        .1.. .... = Don't fragment: Set
        ..0. .... = More fragments: Not set
    ...0 0000 0000 0000 = Fragment Offset: 0
    Time to Live: 128
    Protocol: TCP (6)
    Header Checksum: 0xef35 [validation disabled]
    [Header checksum status: Unverified]
    Source Address: 10.160.65.202
    Destination Address: 10.160.64.139
Transmission Control Protocol, Src Port: 445, Dst Port: 38166, Seq: 253, Ack: 231, Len: 252
    Source Port: 445
    Destination Port: 38166
    [Stream index: 0]
    [Conversation completeness: Incomplete (8)]
    [TCP Segment Len: 252]
    Sequence Number: 253    (relative sequence number)
    Sequence Number (raw): 1517249065
    [Next Sequence Number: 505    (relative sequence number)]
    Acknowledgment Number: 231    (relative ack number)
    Acknowledgment number (raw): 743359789
    1000 .... = Header Length: 32 bytes (8)
    Flags: 0x018 (PSH, ACK)
        000. .... .... = Reserved: Not set
        ...0 .... .... = Nonce: Not set
        .... 0... .... = Congestion Window Reduced (CWR): Not set
        .... .0.. .... = ECN-Echo: Not set
        .... ..0. .... = Urgent: Not set
        .... ...1 .... = Acknowledgment: Set
        .... .... 1... = Push: Set
        .... .... .0.. = Reset: Not set
        .... .... ..0. = Syn: Not set
        .... .... ...0 = Fin: Not set
        [TCP Flags: ·······AP···]
    Window: 8235
    [Calculated window size: 8235]
    [Window size scaling factor: -1 (unknown)]
    Checksum: 0xce60 [unverified]
    [Checksum Status: Unverified]
    Urgent Pointer: 0
    Options: (12 bytes), No-Operation (NOP), No-Operation (NOP), Timestamps
        TCP Option - No-Operation (NOP)
            Kind: No-Operation (1)
        TCP Option - No-Operation (NOP)
            Kind: No-Operation (1)
        TCP Option - Timestamps: TSval 162696623, TSecr 3180665813
            Kind: Time Stamp Option (8)
            Length: 10
            Timestamp value: 162696623
            Timestamp echo reply: 3180665813
    [Timestamps]
        [Time since first frame in this TCP stream: 0.007801000 seconds]
        [Time since previous frame in this TCP stream: 0.000283000 seconds]
    [SEQ/ACK analysis]
        [This is an ACK to the segment in frame: 3]
        [The RTT to ACK the segment was: 0.000283000 seconds]
        [Bytes in flight: 252]
        [Bytes sent since last PSH flag: 252]
    TCP payload (252 bytes)
NetBIOS Session Service
    Message Type: Session message (0x00)
    Length: 248
SMB2 (Server Message Block Protocol version 2)
    SMB2 Header
        ProtocolId: 0xfe534d42
        Header Length: 64
        Credit Charge: 0
        NT Status: STATUS_MORE_PROCESSING_REQUIRED (0xc0000016)
        Command: Session Setup (1)
        Credits granted: 1
        Flags: 0x00000001, Response
        Chain Offset: 0x00000000
        Message ID: 1
        Process Id: 0x000000d5
        Tree Id: 0x00000000
        Session Id: 0x000048009400003d Acct:administrator Domain:SUSE Host:
        Signature: 00000000000000000000000000000000
        [Response to: 3]
        [Time from request: 0.000283000 seconds]
    Session Setup Response (0x01)
        [Preauth Hash: 6330bd17d401c3a1c9ebaf2e6a6f8b505c564f8fc5656de589d6163a5b2797a1e968e38f…]
        StructureSize: 0x0009
        Session Flags: 0x0000
        Blob Offset: 0x00000048
        Blob Length: 176
        Security Blob: 4e544c4d53535000020000000800080038000000350289e201151813d2898ccd00000000…

No.     Time           Source                Destination           Protocol Length Info
      5 0.012641       10.160.64.139         10.160.65.202         SMB2     430    Session Setup Request, NTLMSSP_AUTH, User: SUSE\administrator

Frame 5: 430 bytes on wire (3440 bits), 430 bytes captured (3440 bits) on interface unknown, id 0
Ethernet II, Src: Xensourc_44:52:5c (00:16:3e:44:52:5c), Dst: RealtekU_e8:f0:9a (52:54:00:e8:f0:9a)
    Destination: RealtekU_e8:f0:9a (52:54:00:e8:f0:9a)
        Address: RealtekU_e8:f0:9a (52:54:00:e8:f0:9a)
        .... ..1. .... .... .... .... = LG bit: Locally administered address (this is NOT the factory default)
        .... ...0 .... .... .... .... = IG bit: Individual address (unicast)
    Source: Xensourc_44:52:5c (00:16:3e:44:52:5c)
        Address: Xensourc_44:52:5c (00:16:3e:44:52:5c)
        .... ..0. .... .... .... .... = LG bit: Globally unique address (factory default)
        .... ...0 .... .... .... .... = IG bit: Individual address (unicast)
    Type: IPv4 (0x0800)
Internet Protocol Version 4, Src: 10.160.64.139, Dst: 10.160.65.202
    0100 .... = Version: 4
    .... 0101 = Header Length: 20 bytes (5)
    Differentiated Services Field: 0x00 (DSCP: CS0, ECN: Not-ECT)
        0000 00.. = Differentiated Services Codepoint: Default (0)
        .... ..00 = Explicit Congestion Notification: Not ECN-Capable Transport (0)
    Total Length: 416
    Identification: 0x1aeb (6891)
    Flags: 0x40, Don't fragment
        0... .... = Reserved bit: Not set
        .1.. .... = Don't fragment: Set
        ..0. .... = More fragments: Not set
    ...0 0000 0000 0000 = Fragment Offset: 0
    Time to Live: 64
    Protocol: TCP (6)
    Header Checksum: 0x86d8 [validation disabled]
    [Header checksum status: Unverified]
    Source Address: 10.160.64.139
    Destination Address: 10.160.65.202
Transmission Control Protocol, Src Port: 38166, Dst Port: 445, Seq: 231, Ack: 505, Len: 364
    Source Port: 38166
    Destination Port: 445
    [Stream index: 0]
    [Conversation completeness: Incomplete (8)]
    [TCP Segment Len: 364]
    Sequence Number: 231    (relative sequence number)
    Sequence Number (raw): 743359789
    [Next Sequence Number: 595    (relative sequence number)]
    Acknowledgment Number: 505    (relative ack number)
    Acknowledgment number (raw): 1517249317
    1000 .... = Header Length: 32 bytes (8)
    Flags: 0x018 (PSH, ACK)
        000. .... .... = Reserved: Not set
        ...0 .... .... = Nonce: Not set
        .... 0... .... = Congestion Window Reduced (CWR): Not set
        .... .0.. .... = ECN-Echo: Not set
        .... ..0. .... = Urgent: Not set
        .... ...1 .... = Acknowledgment: Set
        .... .... 1... = Push: Set
        .... .... .0.. = Reset: Not set
        .... .... ..0. = Syn: Not set
        .... .... ...0 = Fin: Not set
        [TCP Flags: ·······AP···]
    Window: 490
    [Calculated window size: 490]
    [Window size scaling factor: -1 (unknown)]
    Checksum: 0x7322 [unverified]
    [Checksum Status: Unverified]
    Urgent Pointer: 0
    Options: (12 bytes), No-Operation (NOP), No-Operation (NOP), Timestamps
        TCP Option - No-Operation (NOP)
            Kind: No-Operation (1)
        TCP Option - No-Operation (NOP)
            Kind: No-Operation (1)
        TCP Option - Timestamps: TSval 3180665814, TSecr 162696623
            Kind: Time Stamp Option (8)
            Length: 10
            Timestamp value: 3180665814
            Timestamp echo reply: 162696623
    [Timestamps]
        [Time since first frame in this TCP stream: 0.012641000 seconds]
        [Time since previous frame in this TCP stream: 0.004840000 seconds]
    [SEQ/ACK analysis]
        [This is an ACK to the segment in frame: 4]
        [The RTT to ACK the segment was: 0.004840000 seconds]
        [Bytes in flight: 364]
        [Bytes sent since last PSH flag: 364]
    TCP payload (364 bytes)
NetBIOS Session Service
    Message Type: Session message (0x00)
    Length: 360
SMB2 (Server Message Block Protocol version 2)
    SMB2 Header
        ProtocolId: 0xfe534d42
        Header Length: 64
        Credit Charge: 0
        Channel Sequence: 0
        Reserved: 0000
        Command: Session Setup (1)
        Credits requested: 3
        Flags: 0x00000000
        Chain Offset: 0x00000000
        Message ID: 2
        Process Id: 0x000000d5
        Tree Id: 0x00000000
        Session Id: 0x000048009400003d Acct:administrator Domain:SUSE Host:
        Signature: 00000000000000000000000000000000
        [Response in: 6]
    Session Setup Request (0x01)
        [Preauth Hash: a97c794af6517dc669c42e531a7eb0dd79d7a43d8d863a0b622e0a73c71fc2e3b842ad22…]
        StructureSize: 0x0019
        Flags: 0
        Security mode: 0x02, Signing required
        Capabilities: 0x00000000
            .... .... .... .... .... .... .... ...0 = DFS: This host does NOT support DFS
            .... .... .... .... .... .... .... ..0. = LEASING: This host does NOT support LEASING
            .... .... .... .... .... .... .... .0.. = LARGE MTU: This host does NOT support LARGE_MTU
            .... .... .... .... .... .... .... 0... = MULTI CHANNEL: This host does NOT support MULTI CHANNEL
            .... .... .... .... .... .... ...0 .... = PERSISTENT HANDLES: This host does NOT support PERSISTENT HANDLES
            .... .... .... .... .... .... ..0. .... = DIRECTORY LEASING: This host does NOT support DIRECTORY LEASING
            .... .... .... .... .... .... .0.. .... = ENCRYPTION: This host does NOT support ENCRYPTION
        Channel: None (0x00000000)
        Previous Session Id: 0x0000000000000000
        Blob Offset: 0x00000058
        Blob Length: 272
        Security Blob: 4e544c4d535350000300000000000000400000009c009c004000000008000800dc000000…

No.     Time           Source                Destination           Protocol Length Info
      6 0.013995       10.160.65.202         10.160.64.139         SMB2     142    Session Setup Response

Frame 6: 142 bytes on wire (1136 bits), 142 bytes captured (1136 bits) on interface unknown, id 0
Ethernet II, Src: RealtekU_e8:f0:9a (52:54:00:e8:f0:9a), Dst: Xensourc_44:52:5c (00:16:3e:44:52:5c)
    Destination: Xensourc_44:52:5c (00:16:3e:44:52:5c)
        Address: Xensourc_44:52:5c (00:16:3e:44:52:5c)
        .... ..0. .... .... .... .... = LG bit: Globally unique address (factory default)
        .... ...0 .... .... .... .... = IG bit: Individual address (unicast)
    Source: RealtekU_e8:f0:9a (52:54:00:e8:f0:9a)
        Address: RealtekU_e8:f0:9a (52:54:00:e8:f0:9a)
        .... ..1. .... .... .... .... = LG bit: Locally administered address (this is NOT the factory default)
        .... ...0 .... .... .... .... = IG bit: Individual address (unicast)
    Type: IPv4 (0x0800)
Internet Protocol Version 4, Src: 10.160.65.202, Dst: 10.160.64.139
    0100 .... = Version: 4
    .... 0101 = Header Length: 20 bytes (5)
    Differentiated Services Field: 0x00 (DSCP: CS0, ECN: Not-ECT)
        0000 00.. = Differentiated Services Codepoint: Default (0)
        .... ..00 = Explicit Congestion Notification: Not ECN-Capable Transport (0)
    Total Length: 128
    Identification: 0x72fe (29438)
    Flags: 0x40, Don't fragment
        0... .... = Reserved bit: Not set
        .1.. .... = Don't fragment: Set
        ..0. .... = More fragments: Not set
    ...0 0000 0000 0000 = Fragment Offset: 0
    Time to Live: 128
    Protocol: TCP (6)
    Header Checksum: 0xefe4 [validation disabled]
    [Header checksum status: Unverified]
    Source Address: 10.160.65.202
    Destination Address: 10.160.64.139
Transmission Control Protocol, Src Port: 445, Dst Port: 38166, Seq: 505, Ack: 595, Len: 76
    Source Port: 445
    Destination Port: 38166
    [Stream index: 0]
    [Conversation completeness: Incomplete (8)]
    [TCP Segment Len: 76]
    Sequence Number: 505    (relative sequence number)
    Sequence Number (raw): 1517249317
    [Next Sequence Number: 581    (relative sequence number)]
    Acknowledgment Number: 595    (relative ack number)
    Acknowledgment number (raw): 743360153
    1000 .... = Header Length: 32 bytes (8)
    Flags: 0x018 (PSH, ACK)
        000. .... .... = Reserved: Not set
        ...0 .... .... = Nonce: Not set
        .... 0... .... = Congestion Window Reduced (CWR): Not set
        .... .0.. .... = ECN-Echo: Not set
        .... ..0. .... = Urgent: Not set
        .... ...1 .... = Acknowledgment: Set
        .... .... 1... = Push: Set
        .... .... .0.. = Reset: Not set
        .... .... ..0. = Syn: Not set
        .... .... ...0 = Fin: Not set
        [TCP Flags: ·······AP···]
    Window: 8233
    [Calculated window size: 8233]
    [Window size scaling factor: -1 (unknown)]
    Checksum: 0x713b [unverified]
    [Checksum Status: Unverified]
    Urgent Pointer: 0
    Options: (12 bytes), No-Operation (NOP), No-Operation (NOP), Timestamps
        TCP Option - No-Operation (NOP)
            Kind: No-Operation (1)
        TCP Option - No-Operation (NOP)
            Kind: No-Operation (1)
        TCP Option - Timestamps: TSval 162696628, TSecr 3180665814
            Kind: Time Stamp Option (8)
            Length: 10
            Timestamp value: 162696628
            Timestamp echo reply: 3180665814
    [Timestamps]
        [Time since first frame in this TCP stream: 0.013995000 seconds]
        [Time since previous frame in this TCP stream: 0.001354000 seconds]
    [SEQ/ACK analysis]
        [This is an ACK to the segment in frame: 5]
        [The RTT to ACK the segment was: 0.001354000 seconds]
        [Bytes in flight: 76]
        [Bytes sent since last PSH flag: 76]
    TCP payload (76 bytes)
NetBIOS Session Service
    Message Type: Session message (0x00)
    Length: 72
SMB2 (Server Message Block Protocol version 2)
    SMB2 Header
        ProtocolId: 0xfe534d42
        Header Length: 64
        Credit Charge: 0
        NT Status: STATUS_SUCCESS (0x00000000)
        Command: Session Setup (1)
        Credits granted: 3
        Flags: 0x00000009, Response, Signing
        Chain Offset: 0x00000000
        Message ID: 2
        Process Id: 0x000000d5
        Tree Id: 0x00000000
        Session Id: 0x000048009400003d Acct:administrator Domain:SUSE Host:
        Signature: cbd96f2608ad231666121653f2b2c0b5
        [Response to: 5]
        [Time from request: 0.001354000 seconds]
    Session Setup Response (0x01)
        [Preauth Hash: a97c794af6517dc669c42e531a7eb0dd79d7a43d8d863a0b622e0a73c71fc2e3b842ad22…]
        StructureSize: 0x0009
        Session Flags: 0x0000
        Blob Offset: 0x00000048
        Blob Length: 0
        Security Blob: <MISSING>: NO DATA

No.     Time           Source                Destination           Protocol Length Info
      7 0.020596       10.160.64.139         10.160.65.202         SMB2     180    Tree Connect Request Tree: \\WS2016\encrypted

Frame 7: 180 bytes on wire (1440 bits), 180 bytes captured (1440 bits) on interface unknown, id 0
Ethernet II, Src: Xensourc_44:52:5c (00:16:3e:44:52:5c), Dst: RealtekU_e8:f0:9a (52:54:00:e8:f0:9a)
    Destination: RealtekU_e8:f0:9a (52:54:00:e8:f0:9a)
        Address: RealtekU_e8:f0:9a (52:54:00:e8:f0:9a)
        .... ..1. .... .... .... .... = LG bit: Locally administered address (this is NOT the factory default)
        .... ...0 .... .... .... .... = IG bit: Individual address (unicast)
    Source: Xensourc_44:52:5c (00:16:3e:44:52:5c)
        Address: Xensourc_44:52:5c (00:16:3e:44:52:5c)
        .... ..0. .... .... .... .... = LG bit: Globally unique address (factory default)
        .... ...0 .... .... .... .... = IG bit: Individual address (unicast)
    Type: IPv4 (0x0800)
Internet Protocol Version 4, Src: 10.160.64.139, Dst: 10.160.65.202
    0100 .... = Version: 4
    .... 0101 = Header Length: 20 bytes (5)
    Differentiated Services Field: 0x00 (DSCP: CS0, ECN: Not-ECT)
        0000 00.. = Differentiated Services Codepoint: Default (0)
        .... ..00 = Explicit Congestion Notification: Not ECN-Capable Transport (0)
    Total Length: 166
    Identification: 0x1aec (6892)
    Flags: 0x40, Don't fragment
        0... .... = Reserved bit: Not set
        .1.. .... = Don't fragment: Set
        ..0. .... = More fragments: Not set
    ...0 0000 0000 0000 = Fragment Offset: 0
    Time to Live: 64
    Protocol: TCP (6)
    Header Checksum: 0x87d1 [validation disabled]
    [Header checksum status: Unverified]
    Source Address: 10.160.64.139
    Destination Address: 10.160.65.202
Transmission Control Protocol, Src Port: 38166, Dst Port: 445, Seq: 595, Ack: 581, Len: 114
    Source Port: 38166
    Destination Port: 445
    [Stream index: 0]
    [Conversation completeness: Incomplete (8)]
    [TCP Segment Len: 114]
    Sequence Number: 595    (relative sequence number)
    Sequence Number (raw): 743360153
    [Next Sequence Number: 709    (relative sequence number)]
    Acknowledgment Number: 581    (relative ack number)
    Acknowledgment number (raw): 1517249393
    1000 .... = Header Length: 32 bytes (8)
    Flags: 0x018 (PSH, ACK)
        000. .... .... = Reserved: Not set
        ...0 .... .... = Nonce: Not set
        .... 0... .... = Congestion Window Reduced (CWR): Not set
        .... .0.. .... = ECN-Echo: Not set
        .... ..0. .... = Urgent: Not set
        .... ...1 .... = Acknowledgment: Set
        .... .... 1... = Push: Set
        .... .... .0.. = Reset: Not set
        .... .... ..0. = Syn: Not set
        .... .... ...0 = Fin: Not set
        [TCP Flags: ·······AP···]
    Window: 490
    [Calculated window size: 490]
    [Window size scaling factor: -1 (unknown)]
    Checksum: 0xfabd [unverified]
    [Checksum Status: Unverified]
    Urgent Pointer: 0
    Options: (12 bytes), No-Operation (NOP), No-Operation (NOP), Timestamps
        TCP Option - No-Operation (NOP)
            Kind: No-Operation (1)
        TCP Option - No-Operation (NOP)
            Kind: No-Operation (1)
        TCP Option - Timestamps: TSval 3180665816, TSecr 162696628
            Kind: Time Stamp Option (8)
            Length: 10
            Timestamp value: 3180665816
            Timestamp echo reply: 162696628
    [Timestamps]
        [Time since first frame in this TCP stream: 0.020596000 seconds]
        [Time since previous frame in this TCP stream: 0.006601000 seconds]
    [SEQ/ACK analysis]
        [This is an ACK to the segment in frame: 6]
        [The RTT to ACK the segment was: 0.006601000 seconds]
        [Bytes in flight: 114]
        [Bytes sent since last PSH flag: 114]
    TCP payload (114 bytes)
NetBIOS Session Service
    Message Type: Session message (0x00)
    Length: 110
SMB2 (Server Message Block Protocol version 2)
    SMB2 Header
        ProtocolId: 0xfe534d42
        Header Length: 64
        Credit Charge: 1
        Channel Sequence: 0
        Reserved: 0000
        Command: Tree Connect (3)
        Credits requested: 2
        Flags: 0x00000008, Signing
        Chain Offset: 0x00000000
        Message ID: 3
        Process Id: 0x000000d5
        Tree Id: 0x00000000
        Session Id: 0x000048009400003d Acct:administrator Domain:SUSE Host:
        Signature: 71ad17fd1d838197048999eb7b906ce3
        [Response in: 8]
    Tree Connect Request (0x03)
        StructureSize: 0x0009
        Flags: 0x0000
        Tree: \\WS2016\encrypted

No.     Time           Source                Destination           Protocol Length Info
      8 0.020693       10.160.65.202         10.160.64.139         SMB2     150    Tree Connect Response

Frame 8: 150 bytes on wire (1200 bits), 150 bytes captured (1200 bits) on interface unknown, id 0
Ethernet II, Src: RealtekU_e8:f0:9a (52:54:00:e8:f0:9a), Dst: Xensourc_44:52:5c (00:16:3e:44:52:5c)
    Destination: Xensourc_44:52:5c (00:16:3e:44:52:5c)
        Address: Xensourc_44:52:5c (00:16:3e:44:52:5c)
        .... ..0. .... .... .... .... = LG bit: Globally unique address (factory default)
        .... ...0 .... .... .... .... = IG bit: Individual address (unicast)
    Source: RealtekU_e8:f0:9a (52:54:00:e8:f0:9a)
        Address: RealtekU_e8:f0:9a (52:54:00:e8:f0:9a)
        .... ..1. .... .... .... .... = LG bit: Locally administered address (this is NOT the factory default)
        .... ...0 .... .... .... .... = IG bit: Individual address (unicast)
    Type: IPv4 (0x0800)
Internet Protocol Version 4, Src: 10.160.65.202, Dst: 10.160.64.139
    0100 .... = Version: 4
    .... 0101 = Header Length: 20 bytes (5)
    Differentiated Services Field: 0x00 (DSCP: CS0, ECN: Not-ECT)
        0000 00.. = Differentiated Services Codepoint: Default (0)
        .... ..00 = Explicit Congestion Notification: Not ECN-Capable Transport (0)
    Total Length: 136
    Identification: 0x72ff (29439)
    Flags: 0x40, Don't fragment
        0... .... = Reserved bit: Not set
